{"checks":[{"check":"curated_schema_and_integrity","detail":{"validated":true},"status":"passed"},{"check":"immutable_schema_and_integrity","detail":{"validated":true},"status":"passed"},{"check":"staging_schema_and_integrity","detail":{"validated":true},"status":"passed"},{"check":"typed_graph_reachability","detail":{"concepts":132,"orphan_ids":["c_render_negatives"],"reachable":131},"status":"attention_required"},{"check":"neo4j_projection_readiness","detail":{"configured":false,"networkx_logical_digest":"sha256:e5efcb140412ac8037d8d95476eebbba7e9dab3b87160bcd6e0c317f5328c128","plan_status":"not_built_unconfigured"},"status":"attention_required"},{"check":"source_closure","detail":{"concepts":132,"partial":11,"polymath_dependent_concepts":37,"polymath_quarantined_concepts":37,"quarantined":42,"source_closed":79,"source_units":131},"status":"attention_required"},{"check":"domain_semantic_coverage","detail":{"curated":1,"expected":1,"manifests":1,"missing":0,"operationally_mapped":0,"retrieval_qualified":1,"source_complete_manifests":0},"status":"attention_required"}],"domain_coverage":{"manifests":[{"completeness_claim":"seed_subset_only","curated_ids":["c_facs_events"],"domain":"performance","expected_ids":["c_facs_events"],"inventory_name":"FACS concepts currently registered in CPCS","inventory_scope":"registered_subset","manifest_id":"domain_inventory_facs_registered_seed","missing_ids":[],"operationally_mapped_ids":[],"retrieval_qualified_ids":["c_facs_events"],"source_refs":["ontology://identifier_facs_action_unit"]}],"policy_version":"cpcs-domain-coverage/1.0","report_hash":"sha256:a8712631de731444ca0c6e4c399f1c773ce8f77520465ee6f78eb234918e3413","schema":"cpcs.domain_coverage_report/1.0","summary":{"curated":1,"expected":1,"manifests":1,"missing":0,"operationally_mapped":0,"retrieval_qualified":1,"source_complete_manifests":0}},"policy_version":"cpcs-brain-health/1.0","projection":{"automatic_sync_requires_exact_authorization":true,"backend":"networkx","configured":false,"database":"neo4j","edge_count":300,"fallback_policy":"fail_closed","namespace":"cpcs","networkx_logical_digest":"sha256:e5efcb140412ac8037d8d95476eebbba7e9dab3b87160bcd6e0c317f5328c128","node_count":151,"plan_status":"not_built_unconfigured","required_environment_present":{"CPCS_NEO4J_OWNERSHIP":false,"CPCS_NEO4J_PASSWORD":false,"CPCS_NEO4J_URI":false,"CPCS_NEO4J_USER":false},"secret_values_exposed":false},"report_hash":"sha256:a6e00ddbad1e7627703c1f1f400797852468d978519c8175abc9ff4839877514","repository_revision":"sha256:e5efcb140412ac8037d8d95476eebbba7e9dab3b87160bcd6e0c317f5328c128","schema":"cpcs.brain_health_report/1.0","source_closure":{"concepts":[{"concept_id":"c_actable_objective_transition","source_unit_ids":[],"status":"quarantined","unresolved_references":[{"reason":"external_passage_not_admitted","reference":"polymath://149a2dcb-8c61-404e-8006-1df7e3791b5a/document/67bc3e7930c33e4f4850b7ca4c6f69c9ece5f6ec57ff0853d6329b5321f2c9d9#chunk=67bc3e7930c33e4f4850b7ca4c6f69c9ece5f6ec57ff0853d6329b5321f2c9d9_0648"}]},{"concept_id":"c_action_atoms","source_unit_ids":["source_unit_775053160c170fbf4f1752c3","source_unit_b02381890f8547c85ad5d72a"],"status":"source_closed","unresolved_references":[]},{"concept_id":"c_action_first_emotional_release","source_unit_ids":[],"status":"quarantined","unresolved_references":[{"reason":"external_passage_not_admitted","reference":"polymath://149a2dcb-8c61-404e-8006-1df7e3791b5a/document/36cd4f24fc36392138cac6405d59edbb5534f7ff05ead33dc9365a7c5578af28#chunk=36cd4f24fc36392138cac6405d59edbb5534f7ff05ead33dc9365a7c5578af28_1243"}]},{"concept_id":"c_action_verb_sound_mapping","source_unit_ids":[],"status":"quarantined","unresolved_references":[{"reason":"external_passage_not_admitted","reference":"polymath://149a2dcb-8c61-404e-8006-1df7e3791b5a/document/c2812f1e082d0a97e2b4eacd1f05b64d180942f69cf622d5ad7dfa1a82b53d30#chunk=c2812f1e082d0a97e2b4eacd1f05b64d180942f69cf622d5ad7dfa1a82b53d30_0103"}]},{"concept_id":"c_adapter_contract","source_unit_ids":["source_unit_07a297927aa30b97695df185","source_unit_d17b9dbdc0755d72ef23bbc5"],"status":"source_closed","unresolved_references":[]},{"concept_id":"c_anime_vfx_layer","source_unit_ids":["source_unit_0aa4a25e6cf1818449894c69","source_unit_0df3cec762c20973931ca996"],"status":"source_closed","unresolved_references":[]},{"concept_id":"c_atomic_deconstruction","source_unit_ids":["source_unit_c51344c56b7ef4ff81a8eca7"],"status":"source_closed","unresolved_references":[]},{"concept_id":"c_atomic_ontology","source_unit_ids":["source_unit_8123ea69300aed22ff02732f"],"status":"source_closed","unresolved_references":[]},{"concept_id":"c_audio_spec","source_unit_ids":["source_unit_98a28a12bdb01ab4c3f199dd","source_unit_d187abc7fb72d6964e081519"],"status":"partial","unresolved_references":[{"reason":"unregistered_reference","reference":"owner combat spec"}]},{"concept_id":"c_authenticity_cues","source_unit_ids":["source_unit_ec2a7df84aaa5b6c3133d8d0"],"status":"partial","unresolved_references":[{"reason":"missing_local_source","reference":"lab/references/iphone_rawugc_realism.md"}]},{"concept_id":"c_beat_per_clip","source_unit_ids":["source_unit_bcd82e160a31e5cfc0cfb56c"],"status":"source_closed","unresolved_references":[]},{"concept_id":"c_body_mechanics","source_unit_ids":["source_unit_7a0def1049cdb87d87cafcf3","source_unit_cc8ffe48669d22bfa48d2a0c"],"status":"partial","unresolved_references":[{"reason":"unregistered_reference","reference":"owner combat spec"}]},{"concept_id":"c_breath_movement_coupling","source_unit_ids":[],"status":"quarantined","unresolved_references":[{"reason":"external_passage_not_admitted","reference":"polymath://149a2dcb-8c61-404e-8006-1df7e3791b5a/document/e52a308ba5ab89d1ca181542b81add0ec05361c7f0e89f68041b6cce7dee915a#chunk=e52a308ba5ab89d1ca181542b81add0ec05361c7f0e89f68041b6cce7dee915a_0269"}]},{"concept_id":"c_camera_keyframes","source_unit_ids":["source_unit_fe9404ddab27b51d1ef9e1ee"],"status":"source_closed","unresolved_references":[]},{"concept_id":"c_camera_object_separation","source_unit_ids":["source_unit_59db7e0a7c7db22073907a99","source_unit_91073510d03943a5a632274f"],"status":"source_closed","unresolved_references":[]},{"concept_id":"c_char_budget","source_unit_ids":["source_unit_506addbedf2c8107763f0926"],"status":"source_closed","unresolved_references":[]},{"concept_id":"c_character_goal_subtext","source_unit_ids":[],"status":"quarantined","unresolved_references":[{"reason":"external_passage_not_admitted","reference":"polymath://149a2dcb-8c61-404e-8006-1df7e3791b5a/document/96b7076a7bef5713bf6681e296e5bf8b5fe3ea79280bb2563ffea25093c62717#chunk=96b7076a7bef5713bf6681e296e5bf8b5fe3ea79280bb2563ffea25093c62717_0568"}]},{"concept_id":"c_character_profile","source_unit_ids":["source_unit_2b0cbbf2c3175a6895771fbb","source_unit_d9260a25cc1ed90a78261921"],"status":"partial","unresolved_references":[{"reason":"unregistered_reference","reference":"owner combat spec"}]},{"concept_id":"c_clipped_analysis","source_unit_ids":["source_unit_04bea2e941fd03a60b4be8d1"],"status":"source_closed","unresolved_references":[]},{"concept_id":"c_communication_graph","source_unit_ids":["source_unit_bcd82e160a31e5cfc0cfb56c"],"status":"source_closed","unresolved_references":[]},{"concept_id":"c_compilation_tiers","source_unit_ids":["source_unit_7ffaae3610d4544c727908f1","source_unit_ff6a45b0d035b08649b06dd0"],"status":"source_closed","unresolved_references":[]},{"concept_id":"c_concealed_effect_reveal","source_unit_ids":[],"status":"quarantined","unresolved_references":[{"reason":"external_passage_not_admitted","reference":"polymath://149a2dcb-8c61-404e-8006-1df7e3791b5a/document/4bc34dfa894ad4c3ea3831073acb3419e9858e9af9b2198001ba8eb6cbdbba64#chunk=4bc34dfa894ad4c3ea3831073acb3419e9858e9af9b2198001ba8eb6cbdbba64_0341"}]},{"concept_id":"c_contact_solver","source_unit_ids":["source_unit_5b372581a20728a5e0c7c83c"],"status":"source_closed","unresolved_references":[]},{"concept_id":"c_content_perf_style_presentation","source_unit_ids":["source_unit_455ff64c1b3d8ccee58a0120"],"status":"source_closed","unresolved_references":[]},{"concept_id":"c_contradiction_pass","source_unit_ids":["source_unit_4a461b6912f46ceef6d02fad"],"status":"source_closed","unresolved_references":[]},{"concept_id":"c_control_plane","source_unit_ids":["source_unit_45c68d2248c756ca03f2a4ef","source_unit_8187645e10b90f0cb8f719bb"],"status":"source_closed","unresolved_references":[]},{"concept_id":"c_correlated_variation","source_unit_ids":["source_unit_08e353e3c18cc164066e5947","source_unit_209960fb217e2a64f14b075c"],"status":"source_closed","unresolved_references":[]},{"concept_id":"c_cross_key_light_sightline","source_unit_ids":[],"status":"quarantined","unresolved_references":[{"reason":"external_passage_not_admitted","reference":"polymath://149a2dcb-8c61-404e-8006-1df7e3791b5a/document/e2cb70e9ba724a164b73c49fbbd2310812244e5c3c0d2b013d099e8546309f2c#chunk=e2cb70e9ba724a164b73c49fbbd2310812244e5c3c0d2b013d099e8546309f2c_0389"}]},{"concept_id":"c_dense_assets_media","source_unit_ids":["source_unit_cf6fb0045cfe1e5d0f18a98d"],"status":"source_closed","unresolved_references":[]},{"concept_id":"c_dramatic_action_motivated_camera","source_unit_ids":[],"status":"quarantined","unresolved_references":[{"reason":"external_passage_not_admitted","reference":"polymath://149a2dcb-8c61-404e-8006-1df7e3791b5a/document/ba520febaf47f6712b212c794315c276cbbeb66ad250e77d85485c7a3aa6f739#chunk=ba520febaf47f6712b212c794315c276cbbeb66ad250e77d85485c7a3aa6f739_0333"}]},{"concept_id":"c_dual_view_color_integration","source_unit_ids":[],"status":"quarantined","unresolved_references":[{"reason":"external_passage_not_admitted","reference":"polymath://149a2dcb-8c61-404e-8006-1df7e3791b5a/document/f4e5f68b188beb3aad3e9f1d10846c1d9c1747b2d872b701f5e2757e14dd5305#chunk=f4e5f68b188beb3aad3e9f1d10846c1d9c1747b2d872b701f5e2757e14dd5305_2397"}]},{"concept_id":"c_duchenne","source_unit_ids":["source_unit_84b67537b585f09a1c